{
  "$schema": "./promotion-manifest.schema.json",
  "schema_version": "szl.hf-promotion-manifest.v1",
  "manifest_id": "SZL-HF-Promotion-Guard-v1",
  "as_of": "2026-07-15",
  "mode": "OFFLINE_AUDIT_ONLY",
  "network_access_allowed": false,
  "credential_access_allowed": false,
  "automatic_upload_allowed": false,
  "canonical_authority": "VERSIONED_HUGGING_FACE_REPOSITORY_PLUS_SIGNED_RELEASE_RECEIPT",
  "bucket_authority": "MUTABLE_NONCANONICAL_STAGING_ONLY",
  "local_artifact_hash_basis": "TEXT_UTF8_LF_BINARY_RAW",
  "topology_contract": "model_release/szl-hf-bucket-topology.json",
  "candidates": [
    {
      "candidate_id": "SZL-Nemo-runtime-recipe-v1",
      "candidate_slug": "szl-nemo-runtime-recipe-v1",
      "artifact_class": "CONFIGURATION_RECIPE",
      "canonical_target": "SZLHOLDINGS/szl-nemo",
      "target_kind": "MODEL",
      "target_state": "EXISTS_RECIPE_ONLY_NO_SZL_WEIGHTS",
      "promotion_decision": "BLOCKED_WEIGHT_PROMOTION_RECIPE_ONLY",
      "allowed_public_payload_classes": [
        "MODEL_CARD",
        "OLLAMA_MODELFILE",
        "RELEASE_MANIFEST",
        "LICENSE_NOTICE",
        "SANITIZED_RUNTIME_RECEIPT"
      ],
      "forbidden_public_payload_classes": [
        "SZL_TRAINED_WEIGHT",
        "SZL_ADAPTER",
        "TRAINER_STATE",
        "OPTIMIZER_STATE",
        "UPSTREAM_WEIGHT_REDISTRIBUTION_WITHOUT_LICENSE_REVIEW"
      ],
      "bucket_prefixes": {
        "build": "attempts/{attempt_id}/payload/szl-nemo-runtime-recipe-v1/",
        "evaluation": "attempts/{attempt_id}/payload/szl-nemo-runtime-recipe-v1/",
        "runtime": "batches/{attempt_id}/payload/szl-nemo-runtime-recipe-v1/"
      },
      "model_card_truth": {
        "path": "model_release/szl-nemo/MODEL_CARD_DRAFT.md",
        "required_literals": [
          "CONFIGURATION RECIPE - NOT AN SZL WEIGHT RELEASE",
          "RUNTIME_QUALIFIED_RECIPE_NOT_FINE_TUNED",
          "license_name: NVIDIA Nemotron Open Model License",
          "SZL fine-tuned: `false`",
          "Model quality | `NOT_ESTABLISHED`",
          "NVIDIA Nemotron Open Model License",
          "Public inference | `disabled`"
        ],
        "forbidden_case_insensitive_literals": [
          "szl-trained nemotron weights",
          "fully fine-tuned",
          "quality: established",
          "production ready"
        ]
      },
      "local_artifacts": [
        {
          "path": "model_release/szl-nemo/release-manifest.json",
          "bytes": 2572,
          "sha256": "12e01c005fa08a1061b417d9bb413fe288d7f210da2390953a8e985ab43fbc4a",
          "role": "RELEASE_CONTRACT"
        },
        {
          "path": "model_release/szl-nemo/release-manifest.schema.json",
          "bytes": 3653,
          "sha256": "7487478d3010931223105dcfbaa6b68264f0d2ec2cb5f096970223e5b88f64ff",
          "role": "RELEASE_SCHEMA"
        },
        {
          "path": "model_release/szl-nemo/MODEL_CARD_DRAFT.md",
          "bytes": 3073,
          "sha256": "8b26957d2cd70abfae24548ffed51021e72d92bfd80ed533124d3c203671bdbb",
          "role": "MODEL_CARD"
        },
        {
          "path": "model_release/szl-nemo/Modelfile",
          "bytes": 678,
          "sha256": "ec2d527cd22115c626fa663c9abcb6a7003c180f4fdb489ff79fdaba2da2b1b2",
          "role": "RUNTIME_RECIPE"
        },
        {
          "path": "attestations/szl-nemo-live-2026-07-15.json",
          "bytes": 2432,
          "sha256": "8cbd3f5e0ece21e08fc2fdc06a947c71216ddc83415327b9501fa501d8cfa1fb",
          "role": "LOCAL_RUNTIME_ATTESTATION"
        }
      ],
      "qualification_gates": [
        {"gate_id": "NEMO-G01", "name": "upstream_identity_and_license", "state": "PASS", "blocking": true, "evidence": "release-manifest.json and local attestation bind NVIDIA origin, exact upstream manifest, and NVIDIA license."},
        {"gate_id": "NEMO-G02", "name": "exact_local_load_and_generate", "state": "PASS", "blocking": true, "evidence": "One exact szl-nemo:latest loopback inference and process-boot DSSE receipt verified."},
        {"gate_id": "NEMO-G03", "name": "nemotron_compatible_szl_adapter", "state": "ABSENT", "blocking": true, "evidence": "No Nemotron-compatible SZL adapter exists; the Qwen adapter is architecture- and vocabulary-incompatible."},
        {"gate_id": "NEMO-G04", "name": "admitted_training_data_and_run", "state": "NOT_RUN", "blocking": true, "evidence": "No SZL-Nemo training contract execution or admitted training split exists."},
        {"gate_id": "NEMO-G05", "name": "held_out_quality_safety_and_restart", "state": "NOT_RUN", "blocking": true, "evidence": "A single runtime identity probe is not a held-out model qualification suite."},
        {"gate_id": "NEMO-G06", "name": "organization_identity_attestation_and_log", "state": "ABSENT", "blocking": true, "evidence": "The observed key is process-boot-ephemeral and no transparency-log release record exists."},
        {"gate_id": "NEMO-G07", "name": "independent_hub_readback", "state": "NOT_RUN", "blocking": true, "evidence": "No trained candidate has been uploaded; therefore no immutable remote weight readback can exist."}
      ]
    },
    {
      "candidate_id": "SZL-Nemo-Governed-Adapter-v1",
      "candidate_slug": "szl-nemo-governed-adapter-v1",
      "artifact_class": "PEFT_ADAPTER",
      "canonical_target": "SZLHOLDINGS/SZL-Nemo-Governed-Adapter",
      "target_kind": "MODEL",
      "target_state": "PLANNED_NOT_CREATED",
      "promotion_decision": "BLOCKED_NOT_TRAINED_NOT_QUALIFIED",
      "allowed_public_payload_classes": [
        "PEFT_ADAPTER_SAFETENSORS",
        "ADAPTER_CONFIG_JSON",
        "MODEL_CARD",
        "LICENSE_NOTICE",
        "SIGNED_PROVENANCE",
        "SANITIZED_EVALUATION_SUMMARY"
      ],
      "forbidden_public_payload_classes": [
        "FULL_NVIDIA_BASE_WEIGHTS",
        "PICKLE_OR_EXECUTABLE_MODEL_PAYLOAD",
        "OPTIMIZER_STATE",
        "TRAINER_STATE",
        "HELD_OUT_ANSWER_KEYS",
        "UNADMITTED_BRAIN_OR_FORMULA_ROWS"
      ],
      "bucket_prefixes": {
        "build": "attempts/{attempt_id}/payload/szl-nemo-governed-adapter-v1/",
        "evaluation": "attempts/{attempt_id}/payload/szl-nemo-governed-adapter-v1/",
        "runtime": "batches/{attempt_id}/payload/szl-nemo-governed-adapter-v1/"
      },
      "model_card_truth": {
        "path": "model_release/szl-nemo/MODEL_CARD_TRAINED_CANDIDATE_DRAFT.md",
        "required_literals": [
          "TRAINING CANDIDATE - NO ADAPTER WEIGHTS YET",
          "WSL_MAMBA_IMPORT_QUALIFIED_CAPACITY_NOT_RUN",
          "Quality: `NOT_ESTABLISHED`",
          "SZL adapter weights | `ABSENT`",
          "Exact base revision | `dfaf35de3e30f1867dd8dbc38a7fc9fb52d3914f`",
          "NVIDIA Nemotron Open Model License",
          "Public inference | `disabled`"
        ],
        "forbidden_case_insensitive_literals": [
          "fully fine-tuned",
          "quality: established",
          "production ready",
          "szl owns the nvidia base"
        ]
      },
      "local_artifacts": [
        {
          "path": "model_release/szl-nemo/training-contract.json",
          "bytes": 13840,
          "sha256": "371d620243e1fb8270bc4bde6a6fb814e13a8e73aca4121ec36fb62181d5843e",
          "role": "TRAINING_CONTRACT"
        },
        {
          "path": "model_release/szl-nemo/curriculum-source.json",
          "bytes": 5155,
          "sha256": "5f5ad66eb2447c24d2693ff703d534e9c92a0a2498d695f658dbd49fe263f604",
          "role": "PROJECT_AUTHORED_CURRICULUM_SOURCE"
        },
        {
          "path": "model_release/szl-nemo/curriculum-source.schema.json",
          "bytes": 1822,
          "sha256": "6094cbf6835409464fa3b6cea439ab2ac84aa877ba470badf379143d2ea9a2cf",
          "role": "CURRICULUM_SCHEMA"
        },
        {
          "path": "model_release/szl-nemo/generated/curriculum-manifest.json",
          "bytes": 1860,
          "sha256": "91a8da734af0e5d96c7bc236872060d726209ebddfb1f5974f537830020be358",
          "role": "CURRICULUM_MANIFEST"
        },
        {
          "path": "model_release/szl-nemo/generated/train.jsonl",
          "bytes": 21701,
          "sha256": "513b58282a1a3ccb34145167d4acd8525093ecd2ad9a29c0a8f9af8cd46ac3fd",
          "role": "TRAIN_SPLIT"
        },
        {
          "path": "model_release/szl-nemo/generated/eval.jsonl",
          "bytes": 5967,
          "sha256": "caeb07c94929c24a47fd12f35cbc9021523308dc9fcc684bd444ffcf4a367b0d",
          "role": "HELD_OUT_EVAL_SPLIT"
        },
        {
          "path": "model_release/szl-nemo/szl_nemo_finetune.py",
          "bytes": 102669,
          "sha256": "39b28829a86f10edd183a5fb362fd44af383f41d595339f584df5cb4d3639d60",
          "role": "OFFLINE_TRAINER"
        },
        {
          "path": "model_release/szl-nemo/Invoke-SZLNemoFineTuneQueue.ps1",
          "bytes": 2059,
          "sha256": "32ef37a7d74896a6f47a4185e896536ae68960216ad3911488f4a2322b78869b",
          "role": "LEGACY_WINDOWS_STATUS_AND_QUEUE_TRAIN_REFUSAL"
        },
        {
          "path": "model_release/szl-nemo/MODEL_CARD_TRAINED_CANDIDATE_DRAFT.md",
          "bytes": 4620,
          "sha256": "767eb40945b6a1ee462779b5d1b36b9068edec6ff4031b095c375b2cc7107df8",
          "role": "MODEL_CARD"
        },
        {
          "path": "model_release/szl-nemo/setup_wsl_runtime.sh",
          "bytes": 5344,
          "sha256": "4500c2f0f3ef4fbbf793e4f909415ee023fe1801167ba39f355bf1368b8764c0",
          "role": "PINNED_WSL_RUNTIME_SETUP"
        },
        {
          "path": "model_release/szl-nemo/wsl_runtime_probe.py",
          "bytes": 10362,
          "sha256": "37be64aa7d7fd56648191c1645578fd8d903d34bad031e4fa25dafca807b7d8e",
          "role": "OS_ISOLATED_RUNTIME_PROBE"
        },
        {
          "path": "model_release/szl-nemo/run_wsl_governed.sh",
          "bytes": 6609,
          "sha256": "977c06caeda275a2ce760983ac4a8425b772d1ce085008af20c7284d1c6343e0",
          "role": "GOVERNED_WSL_LAUNCHER"
        },
        {